{
  "schemaVersion": 1,
  "name": "General",
  "settings": {
    "workMinutes": 25,
    "step1Seconds": 30,
    "step2Seconds": 30
  },
  "exercises": [
    "Chin_Tucks",
    "Side_Neck_Stretch",
    "Chin_To_Chest_Stretch",
    "Shoulder_Circles",
    "Shoulder_Raise",
    "Arm_Circles",
    "Elbow_Circles",
    "Shoulder_Stretch",
    "Side_Wrist_Pull",
    "Wall_Slides",
    "Upward_Stretch",
    "Seated_Overhead_Stretch",
    "Triceps_Stretch",
    "Dynamic_Chest_Stretch",
    "Doorway_Pec_Stretch_Low",
    "One_Arm_Against_Wall",
    "Chair_Lower_Back_Stretch",
    "Middle_Back_Stretch",
    "Upper_Back_Stretch",
    "Spinal_Stretch",
    "Standing_Lateral_Stretch",
    "Standing_Pelvic_Tilt",
    "Standing_Hip_Circles",
    "Standing_Hip_Flexors",
    "Ankle_On_The_Knee",
    "Runners_Stretch",
    "Standing_Gastrocnemius_Calf_Stretch",
    "Seated_Calf_Stretch",
    "Standing_Toe_Touches",
    "Chair_Leg_Extended_Stretch",
    "Wrist_Circles",
    "respiration-ventrale"
  ],
  "equipment": []
}
